{
  "schema_version": 2,
  "release_id": "2026-08-03-story-1-3-10001-01-001",
  "created_at": "2026-08-03T12:33:07Z",
  "prepared_from_commit": "6a71578eb61b3d8b06a48e4695370add434cb1aa",
  "transaction_kind": "replace",
  "scope": {
    "kind": "collection",
    "ids": [
      "1_3_10001_01"
    ]
  },
  "entries": [
    {
      "logical_id": "story-collection:1_3_10001_01",
      "domain": "story",
      "source": {
        "archive_relative_path": "asset/scenario_1_3_10001_01.unity3d",
        "sha256": "45cdbee9a3196b2abb4f5c9f2125dc37a1e98e77a22f4f2a8c6bd883fe077e3e",
        "objects": [
          {
            "type": "TextAsset",
            "name": "scenario_1_3_10001_01_a",
            "container_path": "assets/resources/scenariodata/1_3_10001_01/scenario_1_3_10001_01_a.json",
            "path_id": -7396976569279784400
          },
          {
            "type": "TextAsset",
            "name": "scenario_1_3_10001_01_b",
            "container_path": "assets/resources/scenariodata/1_3_10001_01/scenario_1_3_10001_01_b.json",
            "path_id": 2232230511138610429
          },
          {
            "type": "TextAsset",
            "name": "scenario_1_3_10001_01_c",
            "container_path": "assets/resources/scenariodata/1_3_10001_01/scenario_1_3_10001_01_c.json",
            "path_id": -4778049729579378088
          },
          {
            "type": "TextAsset",
            "name": "scenario_1_3_10001_01_d",
            "container_path": "assets/resources/scenariodata/1_3_10001_01/scenario_1_3_10001_01_d.json",
            "path_id": -7939988884295694876
          },
          {
            "type": "TextAsset",
            "name": "scenario_1_3_10001_01_e",
            "container_path": "assets/resources/scenariodata/1_3_10001_01/scenario_1_3_10001_01_e.json",
            "path_id": 1317920532207288893
          },
          {
            "type": "TextAsset",
            "name": "scenario_1_3_10001_01_f",
            "container_path": "assets/resources/scenariodata/1_3_10001_01/scenario_1_3_10001_01_f.json",
            "path_id": -8093821257397690381
          },
          {
            "type": "TextAsset",
            "name": "scenario_1_3_10001_01_g",
            "container_path": "assets/resources/scenariodata/1_3_10001_01/scenario_1_3_10001_01_g.json",
            "path_id": -5494639484746811065
          },
          {
            "type": "TextAsset",
            "name": "scenario_1_3_10001_01_h",
            "container_path": "assets/resources/scenariodata/1_3_10001_01/scenario_1_3_10001_01_h.json",
            "path_id": -8742975774894602826
          },
          {
            "type": "TextAsset",
            "name": "scenario_1_3_10001_01_i",
            "container_path": "assets/resources/scenariodata/1_3_10001_01/scenario_1_3_10001_01_i.json",
            "path_id": -2965773072101965112
          },
          {
            "type": "TextAsset",
            "name": "scenario_1_3_10001_01_j",
            "container_path": "assets/resources/scenariodata/1_3_10001_01/scenario_1_3_10001_01_j.json",
            "path_id": -2907388781185124897
          },
          {
            "type": "TextAsset",
            "name": "scenario_1_3_10001_01_k",
            "container_path": "assets/resources/scenariodata/1_3_10001_01/scenario_1_3_10001_01_k.json",
            "path_id": -1858068924922796231
          }
        ]
      },
      "semantic_evidence": [
        {
          "product": "event_index",
          "key": "10001",
          "evidence": "GROWING SIGN@L -Not Alone-; event_story_chapter_id 410001"
        },
        {
          "product": "story_master_index",
          "key": "event:410001",
          "evidence": "世界を変えるユニット; a-k map to 4100010100-4100010110"
        }
      ],
      "transform": {
        "tool": "scenario_compiler.py + build-authoritative-story-collection.mjs",
        "contract_version": 2
      },
      "published": [
        {
          "path": "web_viewer/public/data/compiled/1_3_10001_01.json",
          "url": "/data/compiled/1_3_10001_01.json",
          "bytes": 1964709,
          "sha256": "137786972e24f511a9ab02a8886b7c7971f3a6a4848692ff75c717425ac3d60f"
        },
        {
          "path": "web_viewer/public/data/compiled/episodes/1_3_10001_01_a.json",
          "url": "/data/compiled/episodes/1_3_10001_01_a.json",
          "bytes": 171653,
          "sha256": "43ea8ff9fee429a794b9835a2c92e843241b3d45cb8c6a71894002d2c7990b49"
        },
        {
          "path": "web_viewer/public/data/compiled/episodes/1_3_10001_01_b.json",
          "url": "/data/compiled/episodes/1_3_10001_01_b.json",
          "bytes": 138107,
          "sha256": "966a0430e4b022dc4c0568febeef21e6c07b27498f9f473e03a904cc0bcc2515"
        },
        {
          "path": "web_viewer/public/data/compiled/episodes/1_3_10001_01_c.json",
          "url": "/data/compiled/episodes/1_3_10001_01_c.json",
          "bytes": 114228,
          "sha256": "4e28643143aa580907ae0206e69ee1d7b626bf21881e7c0d790615681b00f2ad"
        },
        {
          "path": "web_viewer/public/data/compiled/episodes/1_3_10001_01_d.json",
          "url": "/data/compiled/episodes/1_3_10001_01_d.json",
          "bytes": 117764,
          "sha256": "143f08c712ca120af4aff34e761c085d0b3619d482ea37f9e91bce25b1294e61"
        },
        {
          "path": "web_viewer/public/data/compiled/episodes/1_3_10001_01_e.json",
          "url": "/data/compiled/episodes/1_3_10001_01_e.json",
          "bytes": 215329,
          "sha256": "59f0b04a056727b7b2dfc8e2b54536f0a94c6eeaa710af25d68d7ef499a5ef78"
        },
        {
          "path": "web_viewer/public/data/compiled/episodes/1_3_10001_01_f.json",
          "url": "/data/compiled/episodes/1_3_10001_01_f.json",
          "bytes": 124628,
          "sha256": "7a8f5283698a77938655f50af9f896e29f154a4e173e2739229cbdcd69a32c66"
        },
        {
          "path": "web_viewer/public/data/compiled/episodes/1_3_10001_01_g.json",
          "url": "/data/compiled/episodes/1_3_10001_01_g.json",
          "bytes": 184192,
          "sha256": "f7532162abc1fae13aeb1cb95e1482ec671a48ffa7fd4d73fe35e5b640cd1d73"
        },
        {
          "path": "web_viewer/public/data/compiled/episodes/1_3_10001_01_h.json",
          "url": "/data/compiled/episodes/1_3_10001_01_h.json",
          "bytes": 377794,
          "sha256": "9ca858fc42393812833351eea39898084ae5a5481d605ddacb5873b7f9b49eb3"
        },
        {
          "path": "web_viewer/public/data/compiled/episodes/1_3_10001_01_i.json",
          "url": "/data/compiled/episodes/1_3_10001_01_i.json",
          "bytes": 171707,
          "sha256": "15e7b17826bd67c5de80d8f41b71396d9cab8f06c3f16fa430b5852ab7bc9854"
        },
        {
          "path": "web_viewer/public/data/compiled/episodes/1_3_10001_01_j.json",
          "url": "/data/compiled/episodes/1_3_10001_01_j.json",
          "bytes": 196463,
          "sha256": "11bf69cd12bada43b38ffc1b37e5aaff948e3d67d083646358164aee891cd173"
        },
        {
          "path": "web_viewer/public/data/compiled/episodes/1_3_10001_01_k.json",
          "url": "/data/compiled/episodes/1_3_10001_01_k.json",
          "bytes": 156265,
          "sha256": "48b0fc646473115a37cac14eeee25d32c7be60014d85a691ba177479544455e5"
        }
      ],
      "consumers": [
        "StoryViewer",
        "ArchiveEventDetail",
        "eventStoryEpisodes"
      ],
      "comparison": {
        "state": "parity-verified",
        "evidence": [
          "authoritative candidate manifest sha256:e907624fc3be4b49e540a652868bbeb3b19442eedddf8c750f82b800ad5645c3",
          "PYTHONHASHSEED 1, 777, and 314159 runs matched all 12 old, candidate, and compatibility-evidence hashes",
          "12/12 schema-valid and Runtime/text-equivalent; zero non-text differences"
        ]
      },
      "browser_acceptance": {
        "state": "not-tested",
        "tested_url": null,
        "tested_at": null,
        "tested_commit": null,
        "environment": null,
        "evidence": []
      },
      "previous_state": {
        "kind": "unmanaged-existing",
        "release_id": null,
        "artifacts": [
          {
            "path": "web_viewer/public/data/compiled/1_3_10001_01.json",
            "url": "/data/compiled/1_3_10001_01.json",
            "bytes": 833889,
            "sha256": "17dadfb6434836cc3666d57c86db5af3ea74a253556dc626916b18897c386f8e"
          },
          {
            "path": "web_viewer/public/data/compiled/episodes/1_3_10001_01_a.json",
            "url": "/data/compiled/episodes/1_3_10001_01_a.json",
            "bytes": 74410,
            "sha256": "a3abd89c04cf409c4ff590240948a3aca7804bb76368fd510f5dce878a472f0d"
          },
          {
            "path": "web_viewer/public/data/compiled/episodes/1_3_10001_01_b.json",
            "url": "/data/compiled/episodes/1_3_10001_01_b.json",
            "bytes": 61905,
            "sha256": "c68586132c914724f262b07ad79f53581f008408b63216a41fadf6ae08ec2808"
          },
          {
            "path": "web_viewer/public/data/compiled/episodes/1_3_10001_01_c.json",
            "url": "/data/compiled/episodes/1_3_10001_01_c.json",
            "bytes": 47531,
            "sha256": "6e1618821e49efdb91f175ccd375ce6770d1f452b4177d1aaab427c65c1ed326"
          },
          {
            "path": "web_viewer/public/data/compiled/episodes/1_3_10001_01_d.json",
            "url": "/data/compiled/episodes/1_3_10001_01_d.json",
            "bytes": 48338,
            "sha256": "efaa5cbcf5ca3064d5838ffd302102ab30896adf2af6a98f565159e6a6ad22b1"
          },
          {
            "path": "web_viewer/public/data/compiled/episodes/1_3_10001_01_e.json",
            "url": "/data/compiled/episodes/1_3_10001_01_e.json",
            "bytes": 89076,
            "sha256": "aa69aab04f39e45b84060f7a6991e699c2a5510ea394b68918b74a07e4a7cf5d"
          },
          {
            "path": "web_viewer/public/data/compiled/episodes/1_3_10001_01_f.json",